,title,subtitle,link
0,OUT OF THEIR LEAGUE,Supercomputer predicts final Prem table with critical drop for Man Utd,https://www.thesun.co.uk/sport/24115417/supercomputer-premier-league-table-man-utd-burnley/
1,TO THE MAX,Arsenal fans say 'that's CRAZY' as 13-year-old wonderkid makes debut for U18s,https://www.thesun.co.uk/sport/24122618/arsenal-fans-wonderkid-debut-wilshere-u18s-max-dowman/
2,ACE TRAGEDY,"Maddy Cusack's death not suspicious, police say as they release update",https://www.thesun.co.uk/sport/24122544/maddy-cusack-death-not-suspicious-police-update-tragedy/
3,JUST IN LUK,Tottenham COMPLETE deal for 16-year-old defender after beating Chelsea to deal,https://www.thesun.co.uk/sport/24117175/tottenham-complete-signing-centre-back-chelsea-luka-vuskovic/
4,ROD ONE OUT,Fans discover bizarre stat about James Rodriguez's seventh cup in a row,https://www.thesun.co.uk/sport/24123897/fans-james-rodriguez-bizarre-stat-seventh-cup/
5,CHELSEA 0 VILLA 1,Poch's run goes from bad to worse as 10-man Blues are downed by Watkins,https://www.thesun.co.uk/sport/24094295/chelsea-vs-aston-villa-live-score-result-premier-league/
6,POCH WATCH,Ex-Premier League boss seen at Stamford Bridge as pressure mounts on Pochettino,https://www.thesun.co.uk/sport/24119112/premier-league-manager-julen-lopetegui-chelsea-mauricio-pochettino/
7,BRU WHAT?,Chelsea 'secretly get rid of Bruno Saltor' months after landing new job at club,https://www.thesun.co.uk/sport/24121712/chelsea-secretly-bruno-saltor-leave-mauricio-pochettino/
8,POCH'S MARE,Chelsea star Malo Gusto SENT OFF for horror tackle on Aston Villa's Lucas Digne,https://www.thesun.co.uk/sport/24109226/chelsea-malo-gusto-red-card-var-aston-villa-digne/
9,WELCOME OFFER,Join Fabulous Vegas and get a 100% deposit match bonus and 50 free spins,https://www.thesun.co.uk/sun-bingo/23596453/join-fabulous-vegas-bonus-match-free-spins/
10,FEELING BLEW,Chelsea fans fume 'do rules get thrown in BIN when we play' after ref blunder,https://www.thesun.co.uk/sport/24109239/chelsea-fans-fume-referee-blew-early-half-time/
11,CHELSEA RATINGS,Enzo Fernandez struggles but Robert Sanchez is worryingly best in lineup,https://www.thesun.co.uk/sport/24108813/chelsea-player-ratings-enzo-struggles-thirteen-flops/
12,WHAT THE CHEL,Chelsea trolled with fans excited to see Goal of the Month 'from TRAINING',https://www.thesun.co.uk/sport/24110266/chelsea-goal-of-the-month-aston-villa-pochettino/
13,TOP FIFTY,Free bets: Get £50 welcome bonus to spend on football with Paddy Power,https://www.thesun.co.uk/sport/24092720/paddy-power-new-customer-free-bets-football/
14,WELCOME OFFER,Get a £50 bonus when you spend £10 on Sun Vegas,https://www.thesun.co.uk/sun-bingo/23376227/welcome-offer-sun-vegas-bonus/
15,WELCOME OFFER,Get £30 in free bets for the football this weekend with talkSPORT BET,https://www.thesun.co.uk/sport/football/dream-team/23304459/talksportbet-free-bets-new-customers-betting-offer/
16,CARR BLIMEY,Ramsdale's dad slams 'disgraceful' Carragher after remarks about son's antics,https://www.thesun.co.uk/sport/24113548/aaron-ramsdale-dad-jamie-carragher-arsenal-raya/
17,MADD SCENES,Gruesome snap of Maddison's bent knee vs Arsenal emerges with fans left shocked,https://www.thesun.co.uk/sport/24109713/james-maddison-knee-injury-arsenal/
18,ARSENAL RATINGS,Jorginho has nightmare but Declan Rice imperious before getting injured,https://www.thesun.co.uk/sport/24109693/arsenal-player-ratings-jorginho-declan-rice/
19,BACK DOWN,Arteta issues worrying injury update on Rice as he reveals 'strange' situation,https://www.thesun.co.uk/sport/24109992/arsenal-declan-rice-injury-mikel-arteta/
20,WORSE TO COME,Chelsea fans fear they will be 'RELEGATED' with horror games lying in wait,https://www.thesun.co.uk/sport/24110149/chelsea-fans-relegated-fixture-list/
21,SHEFF UTD 0 NEWCASTLE 8,Blades suffer record home loss as EIGHT scorers net for Toon,https://www.thesun.co.uk/sport/24110243/sheff-utd-0-newcastle-8-paul-heckingbottom-record-defeat/
22,BRIGHTON 3 BOURNEMOUTH 1,Mitoma double sees Seagulls come from a goal down to beat Cherries,https://www.thesun.co.uk/sport/24093108/brighton-vs-bournemouth-live-score-result-premier-league/
23,LIVERPOOL 3 WEST HAM 1,"Salah, Nunez and Jota secure crucial Premier League win for Reds",https://www.thesun.co.uk/sport/24096663/liverpool-3-west-1-nunez-salah-van-dijk/
24,'A VOID IN OUR HEARTS',Sheffield United pay tribute to Maddy Cusack after tragic death,https://www.thesun.co.uk/sport/24107794/sheffield-united-tribute-maddy-cusack-newcastle-death/
25,MIS-MANAGED,Mislintat SACKED by Ajax hours after fans smash up stadium and abandon game,https://www.thesun.co.uk/sport/24112905/mislintat-sacked-ajax-fans-smash-stadium-game-abandoned/
26,LOAN RANGER,Ex-Man Utd star who played just once in Prem now slugging it out in League One,https://www.thesun.co.uk/sport/24120227/man-utd-star-league-one-wigan-ben-amos/
27,LIKE FATHER LIKE SON,"Footie icon's son, 16, signs pro deal - can you guess who his dad is?",https://www.thesun.co.uk/sport/24123479/patrick-kluivert-shane-contract-barcelona/
28,CHAPTER EIGHT,Fans ask 'am I seeing this right?' as Sheff Utd fan sits reading a book,https://www.thesun.co.uk/sport/24110689/sheff-utd-fan-reading-book-newcastle/
29,STRIKE PAIR,Kane meets doppelganger at Oktoberfest as he relaxes with Bayern team-mates,https://www.thesun.co.uk/sport/24113570/harry-kane-meets-doppelganger-oktoberfest-bayern-munich/
30,JER JOKING!,Jermaine Jenas slammed by referee charity over tweet during Arsenal vs Spurs,https://www.thesun.co.uk/sport/24111127/bbc-jermaine-jenas-xrated-blast-referee-arsenal-tottenham/
31,BUZZ KYL,Newcastle handed boost as PSG star Mbappe could MISS Champions League clash,https://www.thesun.co.uk/sport/24112980/newcastle-boost-psg-kylian-mbappe-champions-league/
32,ART ATTACK,Vidal slams Ten Hag as 'complicated bald guy' in bizarre rant about Man Utd boss,https://www.thesun.co.uk/sport/24116834/arturo-vidal-erik-ten-hag-rant-man-utd/
33,GOOD CALL,All the best Pay by Mobile casinos revealed - and how to make the most of them,https://www.thesun.co.uk/betting/21296516/pay-by-mobile-casino-uk-2023/
34,LOVE AND CHERISH,Heartbreaking video of ex-Arsenal star's wedding 3 months before wife died,https://www.thesun.co.uk/sport/24107723/derby-josh-vickers-wife-died-cancer-battle/
35,,Jamie Vardy breaks the internet with 's***housery' after 'doing an Adebayor',https://www.thesun.co.uk/sport/24107362/jamie-vardy-leicester-city-adebayor-bristol-city/
36,SPURRED ON,Arsenal fans sing X-rated Kane chant in North London derby to wind up Spurs,https://www.thesun.co.uk/sport/24108807/arsenal-tottenham-harry-kane/
37,'RASH',Neville calls out Spurs star for 'the worst thing you could do' in Arsenal clash,https://www.thesun.co.uk/sport/24108966/gary-neville-tottenham-arsenal-cristian-romero/
38,CASE CLOSED,Best Online Casinos UK - Casino sites top-rated by experts September 2023,https://www.thesun.co.uk/betting/20803800/the-best-online-casinos-in-the-uk/
39,PLAYING AWAY,Defoe’s wife blasts star's 'lover' who was guest at their £200k wedding,https://www.thesun.co.uk/sport/24112366/jermain-defoe-estranged-wife-lover/
40,YOU'RE WELCOME,All the best UK casino welcome bonuses for new players revealed,https://www.thesun.co.uk/betting/21097803/casino-welcome-bonus/
41,TOP OF THE SLOTS,Best payout slots for UK revealed - and where you can play them,https://www.thesun.co.uk/betting/22472603/top-payout-slots-uk/
42,QUICK BUCKS,Get cash quick as a flash with our guide to the best instant withdrawal casinos,https://www.thesun.co.uk/betting/21287535/fast-withdrawal-casinos/
43,WANDA OF YOU,Icardi's glam wife Wanda Nara strips down to lingerie for risque Insta post,https://www.thesun.co.uk/sport/24110986/wanda-nara-strips-lingerie-instagram/
44,SLIM PICKINGS,Everton 'could be forced to SELL Jordan Pickford in January transfer',https://www.thesun.co.uk/sport/24111197/everton-jordan-pickford-transfer-premier-league-takeover/
45,RIK ROLL,Ten Hag brands Man Utd hothead 'perfect' a year after 'training ground scrap',https://www.thesun.co.uk/sport/24115125/man-utd-hannibal-mejbri-burnley-performance-training-ground-fight/
46,MADD MOVES,Saka branded 'savage' for copying Tottenham star's celebration against Spurs,https://www.thesun.co.uk/sport/24109010/saka-savage-copying-tottenham-celebration-maddison/
47,BREACH FOR THE STARS,Who is Jules Breach and what football team does she support?,https://www.thesun.co.uk/sport/21954416/who-is-jules-breach-what-football-team-does-support/
48,BEERS TO THAT,Harry Kane wears lederhosen and poses with stein of beer at Oktoberfest,https://www.thesun.co.uk/sport/24108679/harry-kane-lederhosen-stein-beer-oktoberfest-bundesliga-record/
49,MONEY MEN,Man Utd set to welcome back £145m worth of talent for Crystal Palace clash,https://www.thesun.co.uk/sport/24120816/man-utd-harry-maguire-mason-mount-crystal-palace-injuries/
50,WALK OVER,Alex Scott makes cheeky dig after spat with Dan Walker about Football Focus,https://www.thesun.co.uk/sport/24108912/alex-scott-football-focus-dan-walker-bbc-show/
51,FISHY BUSINESS,Fans revolted at HERRING SANDWICH sold at football club stadium,https://www.thesun.co.uk/sport/24110560/fans-revolted-herring-sandwich-football-stadium-hamburger/
52,JACK IT IN,Jackson banned after fifth yellow card in just six games - ALL for same reason,https://www.thesun.co.uk/sport/24109366/chelsea-nicolas-jackson-banned-yellow-dissent/
53,MANAGER MADNESS,Celtic boss Rodgers rushes on pitch & SHOVES steward to 'rescue' young fan,https://www.thesun.co.uk/sport/24102512/brendan-rodgers-celtic-pitch-invader-livingston/
54,ON THE WARPATH,"Neil Warnock, 74, ALREADY eyeing new manager job after leaving Huddersfield",https://www.thesun.co.uk/sport/24105419/neil-warnock-huddersfield-championship-darren-moore/
55,,Shearer calls his son 'bloody idiot' as Newcastle icon gets clip of Milan antics,https://www.thesun.co.uk/sport/24103154/alan-shearer-son-bloody-idiot-newcastle-milan-champions-league/
56,'HILARIOUS',Fans amazed Crouch is only 6ft 7in as he towers over Jules Breach on TNT Sports,https://www.thesun.co.uk/sport/24105175/peter-crouch-jules-breach-tnt-sports-fans-amazed/
57,BEE STING,Chelsea 'confident of signing' Ivan Toney as Brentford slap £60m fee on striker,https://www.thesun.co.uk/sport/24100662/chelsea-ivan-toney-brentford-transfer/
58,MAN UTD NEWS,"Rashford involved in car crash latest, Utd 'set to sell Sancho', Rabiot linked",https://www.thesun.co.uk/sport/23823324/man-utd-transfer-news-live-marcus-rashford-car-crash-updates/
59,ARSENAL NEWS,"Rice injury LATEST as Arteta speaks, Gunners eye Dembele, £60m Ramsdale 'EXIT'",https://www.thesun.co.uk/sport/23686623/arsenal-transfer-news-live-declan-rice-injury-updates/
60,MAN DEM,Arsenal 'battling Prem rivals for £50m Dembele transfer' as PSG consider selling,https://www.thesun.co.uk/sport/24104948/arsenal-ousmane-dembele-transfer-psg/
61,SCORE BLIMEY,New Dream Team points system explained: Will defensive midfielders be popular?,https://www.thesun.co.uk/sport/football/dream-team/23044593/fantasy-football-premier-league-points-scoring-system-explained/
62,SHARPSHOOTER,Which midfielders have registered the most shots on target so far this season?,https://www.thesun.co.uk/sport/football/dream-team/24070243/midfielders-shots-on-target-fantasy-football-premier-league/
63,LEVEL UP,"Dream Team Loyalty Programme explained: XP (Experience Points), Trophies & Badges",https://www.thesun.co.uk/sport/football/dream-team/23179225/experience-points-trophies-badges-prizes-levels-fantasy-football/
64,LIFE'S A BEACH,Inside Prem club's former owner's abandoned plans for stunning BEACH stadium,https://www.thesun.co.uk/sport/24066956/abandoned-stadium-beach-bournemouth-souness-pulis-redknapp/
65,NOT THAT KAI,Fans spot moment Kai Havertz is 'made to look like a TODDLER' against Spurs,https://www.thesun.co.uk/sport/24113207/arsenal-havertz-toddler-tottenham/
66,RAYA OF LIGHT,Touching moment between Ramsdale and Raya spotted amid Arsenal keeper drama,https://www.thesun.co.uk/sport/24110122/touching-moment-ramsdale-raya-north-london-derby-arsenal/
67,ANIMAL ATTRACTION,Iconic football host Lynam now enjoying career as real-life Dr Doolittle,https://www.thesun.co.uk/sport/24040916/des-lynam-match-of-the-day-dr-doolittle/
68,DINNER DATE,Jack Grealish enjoys date night as he whisks girlfriend out for favourite food,https://www.thesun.co.uk/sport/24108283/jack-grealish-girlfriend-sasha-lamborghini-favourite-food/
69,SOL SEARCHING,I'm a former Man Utd boss but now I have a new life coaching kids football,https://www.thesun.co.uk/sport/24070914/ole-solskjaer-manchester-united-new-career-coaching/
70,HELPING HAND,Man Utd officials paid for taxi to help gran get home after Rashford crash,https://www.thesun.co.uk/sport/24113379/man-utd-officials-paid-taxi-gran-marcus-rashford-crash/
71,FISH4JOBS,Forgotten former Prem manager desperate for new job as he attends two games,https://www.thesun.co.uk/sport/24103709/chris-wilder-premier-league-manager-job-sheffield-united/
72,STRIKER POSE,Harry Kane & Ronaldo dress up after celebrating success on the pitch,https://www.thesun.co.uk/sport/24111660/harry-kane-cristiano-ronaldo-national-costumes/
73,,Fans fear Barca ace Cancelo has been 'possessed' in 'terrifying' interview,https://www.thesun.co.uk/sport/24107467/fans-fear-cancelo-possessed-interview-barcelona-celta-vigo/
74,TRICK OF THE TRADE,Kane's first Bundesliga hat-trick DOESN'T COUNT due to German rule,https://www.thesun.co.uk/sport/24103398/harry-kane-bundesliga-hat-trick-german-rule/
75,SICKNESS BUG,Southampton are in critical condition.. is Doc Martin the answer?,https://www.thesun.co.uk/sport/24107731/southampton-russell-martin-championship-efl/
76,SCOUT'S HONOUR,Mystery as Man Utd send scout to watch Porto despite moving on from target,https://www.thesun.co.uk/sport/24108641/man-utd-scout-watch-porto-transfer/
77,FEAR TO STAY,Spurs look the real deal without Kane - they can cause Arsenal real problems,https://www.thesun.co.uk/sport/24097758/arsenal-tottenham-troy-deeney-kane-preview/
78,KARREN BRADY,Pogba is a huge talent but never handled fame… now his career could be over,https://www.thesun.co.uk/sport/23980536/paul-pogba-career-karren-brady-juventus/
79,DAVE KIDD,"If Ten Hag's tough approach doesn't mean more Man Utd wins, it's not working",https://www.thesun.co.uk/sport/24011614/man-utd-erik-ten-hag-kidd-column-bayern/
80,SEALED WITH A KRIS,Italian sports presenter Kristel Talamonti shows off tan lines in dress,https://www.thesun.co.uk/sport/24101791/kristel-talamonti-italian-sports-presenter/
81,ROUGH CHOWD,TNT Sports host dons 'beautiful' outfit as she heads to North London derby,https://www.thesun.co.uk/sport/24108772/north-london-derby-reshmin-chowdhury-tottenham-arsenal/
82,KISS 'N TELL,I’m an ex-Playboy star and World Cup Wag & I’ll snog men or women when drunk,https://www.thesun.co.uk/sport/24099814/playboy-model-cathy-fischer-kiss-mats-hummels/
